Vendor Name,Vendor Overview,Product Name,Product Description,Legal Functionality,Functionality Sub-Category,Main problem solved,Primary User Segment,Maturity Entry Level,Regions Served,AI Powered,AI Platform Type,Hosting Location,Pricing Model,Demo / Proof of Concept Available,Adoption Level,Ease of Purchase,Deployment Model,Industry Focus,Languages Supported,HQ,Office Locations,Hosting Provider,ISO Certifications,Security & Compliance Certifications,Approx. Price Range (AUD),Customer Reviews,Customer Feedback Rating,Vendor Website,Vendor Contact Details,popularity_score,google_trends_score
Actionstep,"Actionstep is a modern, adaptable law firm management platform designed to automate and organize all the work that happens at midsize law firms.",Actionstep,"Actionstep is a cloud-based law firm management software that helps law firms automate and organize their operations, improve productivity, and manage client and firm data.","Matter, Workflow & Intake Management","Practice Management,Legal Accounting,Document Automation",Automates and organizes law firm operations to improve productivity and profitability.,Corporate legal; Private practice,Advanced,,Yes,Natural Language Processing (NLP) / Text Analytics,,Subscription (SaaS),Demo Available,Growing Adoption,Easy,Cloud (SaaS),Corporate,English only,,,,,,,"Positive reviews highlighting efficiency, user-friendliness, and cloud-based advantages.",,https://www.actionstep.com,,69.0,68.96296296296296
Adobe,"Adobe is a leader in digital experiences, providing solutions like Acrobat and Creative Cloud that transform businesses.",Acrobat Sign,"Acrobat Sign is a stand-alone e-signature solution with unlimited seats, robust integrations, industry-ready compliance, and advanced features.",Contracting & Document Automation,"eSignatures,PDF management",Accelerates business workflows with secure eSign and PDF capabilities.,Corporate legal; Private practice; Legal Operations Professionals,Enterprise-grade,North America (US & Canada); Europe (UK & EU); Asia-Pacific (APAC),Yes,Natural Language Processing (NLP) / Text Analytics; Conversational / Copilot Layer,Multi-Region / Distributed Cloud,Subscription (SaaS),Demo Available,Market Leader / Standard,Easy,Cloud (SaaS),Corporate,English + Limited Other Languages,,,Other,,GDPR Compliance (EU),,,,https://www.adobe.com/au/sign.html,Contact Sales via website,99.0,79.87037037037037
Agiloft,"Agiloft provides a Data-first Agreement Platform (DAP) that revolutionizes Contract Lifecycle Management (CLM) with AI integration, designed to manage contracts efficiently across industries and roles.",Data-first Agreement Platform (DAP),"Agiloft’s award-winning Contract Lifecycle Management (CLM) Platform is designed to manage contracts efficiently across industries and roles, with AI integration for contract review.",Contracting & Document Automation,Contract Lifecycle Management,Efficient contract management and automation with AI integration.,Corporate legal; Legal Operations Professionals; Contract Management Teams / Procurement,Enterprise-grade,Global,Yes,Large Language Model (LLM) Platforms; Natural Language Processing (NLP) / Text Analytics,Australia,Tiered / Plan-Based,Demo Available,Market Leader / Standard,Moderate,Cloud (SaaS),Corporate,English only,,,,ISO 27001,SOC 2 (Type I or II),,,,https://www.agiloft.com,https://www.agiloft.com/lets-talk/?_gl=1*194d0b7*_up*MQ..*_ga*MjAzOTYzMTMuMTc2MTEwOTQ3NA..*_ga_DD5XWF2GJ0*czE3NjExMDk0NzEkbzEkZzEkdDE3NjExMTAwNDckajYwJGwwJGg2MDg0MjkzNTk.,100.0,63.42592592592592
Annature,"Australia's leading eSignature & Client verification provider, offering secure and efficient eSigning and client verification solutions.",Annature eSignature,A digital signature product providing a quick and secure way to send documents and agreements for electronic signature.,Contracting & Document Automation,eSignature and client verification,"Streamlines digital signing and identity verification processes, making them more efficient and secure.",Corporate legal; Private practice,Quick Win,Australia,No,,Australia,Usage-Based / Consumption,"Free Trial,Demo Available",Growing Adoption,Easy,Cloud (SaaS),Corporate,English only,Australia,,,ISO 27001,,<$10K,,,https://www.annature.com.au,https://www.annature.com.au/pricing?_gl=1*1wc567n*_gcl_au*MTE1MTEzMzMyNC4xNzYwOTUxNDcx#request-quote,49.0,52.01851851851852
BigHand,"BigHand offers technology solutions for busy legal professionals that provide data and insights to increase value and profits for your business, your people and your clients.",BigHand,"BigHand provides solutions for workflow management, document creation, financial productivity, and more, tailored for legal professionals.","Matter, Workflow & Intake Management","Document creation,financial productivity,and business intelligence.","Streamlining legal task delegation, document creation, and financial productivity.",Private practice,Enterprise-Grade,Asia-Pacific (APAC),No,,Australia   ,Subscription (SaaS),Demo Available,Mainstream / Proven,Easy,Cloud (SaaS),Corporate,English only,,,,,,,,,https://www.bighand.com,https://www.bighand.com/en-au/contact-us/,70.0,59.51851851851852
Brightflag,"Brightflag is an AI-powered enterprise legal management platform providing solutions for legal e-billing, spend management, and matter management.",Brightflag,"An AI-powered enterprise legal management platform for in-house teams, offering solutions for legal e-billing, spend management, and matter management.",Legal Operations & Analytics,"Legal e-billing,spend management,and matter management.","Provides visibility into legal work and spend, automates invoice review, and enhances budgeting and financial planning.",Corporate legal; Legal Operations Professionals,Enterprise-grade,"North America (US & Canada); Europe (UK & EU),Australia",Yes,Natural Language Processing (NLP) / Text Analytics,Australia   ,Subscription (SaaS),Demo Available,Mainstream / Proven,Moderate,Cloud (SaaS),Corporate,English only,,,,,,,"Brightflag is praised for its intuitive platform, innovative AI, and excellent customer support.",,https://www.brightflag.com,,91.0,25.185185185185187
Bundledocs,"Bundledocs is a document bundling solution that helps users create electronic bundles, briefs, or binders from anywhere. It is designed to be simple, easy to use, and efficient, with no upfront costs or training needed.",Bundledocs,"Bundledocs allows users to compile document bundles for various purposes, including court bundles, deal bibles, and electronic casebooks. It automatically formats, collates, and paginates documents into a single PDF.","Litigation, Disputes & Investigations",Document bundling for legal briefs and court submissions.,"Automates the creation of document bundles, saving time and reducing manual effort in preparing legal briefs.",Litigation / Disputes Teams; Corporate legal; Government / Public Sector,,Europe (UK & EU); Asia-Pacific (APAC); North America (US & Canada),No,,Europe / UK,Subscription (SaaS),Demo Available,Growing Adoption,Very Easy,Cloud (SaaS),Other / Not Specified,English only,"Core House, Westpoint Business Park, Link Road, Ballincollig, Cork, Ireland, P31 E446",,Azure,,,,,,https://www.bundledocs.com,+353 21 203 1007,43.0,54.92592592592592
Checkbox,"Checkbox is an AI-powered intake and workflow automation platform designed for legal teams to manage requests, gain visibility, and automate manual work.",Checkbox Platform,"Checkbox is an AI-powered platform for legal teams to automate intake, matter management, and reporting, providing a single source of truth and enabling legal teams to focus on strategic work.","Matter, Workflow & Intake Management",Intake and workflow automation for legal teams,"Automates legal intake and workflow processes, providing visibility and control over legal matters.",Corporate legal; Legal Operations Professionals,Enterprise-grade,,Yes,Natural Language Processing (NLP) / Text Analytics; Conversational / Copilot Layer,,Subscription (SaaS),Demo Available,Growing Adoption,Easy,Cloud (SaaS),Corporate,English only,,,,,,,,,https://www.checkbox.ai,,73.5,72.57407407407408
Cleardocs,"Cleardocs provides a wide range of current and compliant legal documents online covering Company, Trust and SMSF creation and more. Trusted by over 100,000 customers, our easy to use question interface ensures the document creation process is simple, fast and cost effective.",Cleardocs Document Suite,"Cleardocs provides a comprehensive document suite for legal document creation, including company, trust, and SMSF formations.",Contracting & Document Automation,"Company,Trust,and SMSF document creation",Simplifies the process of creating compliant legal documents quickly and efficiently.,Corporate legal; Private practice,,Australia,No,,,Subscription (SaaS),,Mainstream / Proven,Very Easy,Cloud (SaaS),Corporate,English only,,,,,,,,,https://www.cleardocs.com,,43.5,21.96296296296296
DocuSign,"DocuSign is a market leader in electronic signature and agreement management, trusted by 1.7 million customers.",Intelligent Agreement Management (IAM),"IAM is a platform for creating, managing, and automating agreements with AI-powered tools.",Contracting & Document Automation,"Contract Lifecycle Management,eSignature,Agreement Preparation","Automates and accelerates agreement processes, reducing time and risk.",Corporate legal; Legal Operations Professionals; Contract Management Teams / Procurement,Enterprise-grade,North America (US & Canada); Europe (UK & EU); Asia-Pacific (APAC),Yes,Natural Language Processing (NLP) / Text Analytics; Recommendation & Decision Support Systems,Multi-Region / Distributed Cloud,Subscription (SaaS),Demo Available,Market Leader / Standard,Easy,Cloud (SaaS),Corporate,English only,,,AWS,ISO 27001,GDPR Compliance (EU),,,,https://www.docusign.com,Sales 1-877-720-2040,99.0,84.48148148148148
Everlaw,"Everlaw provides advanced ediscovery software designed to simplify complex legal work for law firms, corporations, and government agencies.",Everlaw Platform,"Everlaw is a cloud-native ediscovery platform that offers advanced analytics, machine learning, and collaboration tools for legal professionals.","Litigation, Disputes & Investigations","Ediscovery,Early Case Assessment,Legal Holds,Trial Preparation,Internal Investigations",Simplifies complex legal work through advanced ediscovery tools and automation.,Corporate legal; Private practice; Government / Public Sector,Enterprise-grade,North America (US & Canada); Europe (UK & EU); Australia,Yes,Predictive / Machine Learning (ML) Platforms; Natural Language Processing (NLP) / Text Analytics,Multi-Region / Distributed Cloud,Subscription (SaaS),Demo Available,Mainstream / Proven,Easy,Cloud (SaaS),Other / Not Specified,English only,United States,"United States, United Kingdom, Canada, European Union, Australia",,,SOC 2 (Type I or II),,,,https://www.everlaw.com,1 (844) EVERLAW (383-7529),91.0,52.31481481481482
FilePro,"FilePro provides all-in-one legal practice management software with various hosting options to support growth, staff, and client experience.",FilePro,"All-in-one legal practice management software with client and matter management, document management, time management, accounting, automation, and workflows.","Matter, Workflow & Intake Management","Client and Matter Management,Document Management,Time Management,Accounting,Automation and Workflows","Provides comprehensive management tools for legal practices to enhance growth, staff, and client experience.",Corporate legal; Private practice,,,No,,,Subscription (SaaS),Demo Available,Growing Adoption,Easy,Cloud (SaaS),Corporate,English only,"Suite 10, 2 Queensgate Drive, Canning Vale WA 6155",,Other,,,,,,https://www.filepro.com.au,Email: [email protected],34.0,2.611111111111111
Gatekeeper,"Gatekeeper is a unified platform for contracting, managing third-party compliance & spend, powered by AI.",Gatekeeper,"Gatekeeper is a platform for contract lifecycle management, vendor lifecycle management, and third-party compliance, powered by AI.",Contracting & Document Automation,"Contract Lifecycle Management,Vendor Lifecycle Management","Reduces vendor risk, accelerates contract processes, and optimizes spend management.",Corporate legal; Legal Operations Professionals; Contract Management Teams / Procurement,Enterprise-grade,,Yes,Natural Language Processing (NLP) / Text Analytics; AI Integration / Orchestration Layer,,Subscription (SaaS),Demo Available,Growing Adoption,Easy,Cloud (SaaS),Corporate,,,,,,,,Gatekeeper is highly rated for its contract management capabilities.,,https://www.gatekeeperhq.com,,73.5,55.7962962962963
Harvey,"Harvey provides domain-specific AI solutions for law firms, professional service providers, and the Fortune 500, focusing on document analysis, workflow automation, and legal intelligence.",Harvey AI,"Harvey AI is a domain-specific AI platform designed to assist with legal document analysis, workflow automation, and legal intelligence.",AI Legal Assistants & Productivity Tools,"Document analysis,workflow automation,legal intelligence",Streamlines legal document analysis and workflow processes using AI.,Corporate legal; Private practice; Legal Operations Professionals,Enterprise-grade,North America (US & Canada); Europe (UK & EU); Australia,Yes,Domain-Specific or Proprietary AI Engines,,,Demo Available,Growing Adoption,,Cloud (SaaS),Professional Services,,,,,,,,,,https://www.harvey.ai,,81.5,52.11111111111112
iManage,"iManage is a knowledge work platform that helps organizations manage documents and emails more efficiently, protect vital information assets, and use knowledge to drive better business outcomes.",iManage Platform,The iManage Platform is a cloud-native knowledge work platform that enhances productivity and mitigates risk with AI built-in natively.,"Knowledge, Search & Precedent Management","Document & Email Management,Security & Governance,Risk & Compliance,Legal Transaction Management,Task & Workflow Management","Improves productivity, protects information assets, and uses knowledge to drive better business outcomes.",Corporate legal; Private practice; Compliance & Risk Teams,Enterprise-grade,,Yes,Natural Language Processing (NLP) / Text Analytics; AI Integration / Orchestration Layer,Multi-Region / Distributed Cloud,,Demo Available,Mainstream / Proven,Moderate,Cloud (SaaS),Corporate,,,,Other,,,,,,https://www.imanage.com,,81.5,64.98148148148148
Immediation,"Immediation is an Alternative Dispute Resolution (ADR) case management platform that forms part of the ADR Technology portfolio. It provides tools for managing mediation, arbitration, and adjudication processes.",Immediation Platform,"A comprehensive case management system for mediation, arbitration, and adjudication, offering tools for case management, automated intake, panel management, and financial management.","Litigation, Disputes & Investigations",Alternative Dispute Resolution (ADR) case management,"Simplifies and automates the management of mediation, arbitration, and adjudication processes.",Alternative Legal Service Providers (ALSPs); Litigation / Disputes Teams,Advanced,North America (US & Canada); Europe (UK & EU); Australia,Yes,Natural Language Processing (NLP) / Text Analytics,,Subscription (SaaS),Demo Available,Growing Adoption,Easy,Cloud (SaaS),Professional Services,English only,"Sydney and Perth, Australia","First Floor, 35 Richardson Street, West Perth, WA, 6005",,,,,,,https://www.immediation.com,hello@immediation.com,78.0,2.9444444444444446
InfoTrack,"InfoTrack provides purpose-built, award-winning technology for legal, conveyancing, and other professional services, focusing on innovation and efficiency.",,"InfoTrack offers a range of solutions including client onboarding, identity verification, contract review, settlement services, and more, with a focus on AI-assisted precision and integration with existing workflows.",Contracting & Document Automation,,Improves operational efficiency and accuracy in legal and conveyancing processes through automation and integration.,Corporate legal; Private practice,Enterprise-grade,Australia,Yes,Natural Language Processing (NLP) / Text Analytics,Australia,,,,,Cloud (SaaS),Corporate,English only,Australia,,,ISO 27001; ISO 9001,,,,,https://www.infotrack.com.au,Get in touch with a member of our team,52.0,73.42592592592592
Josef,"Josef provides legal AI tools for contract automation, workflow automation, and AI Q&A, helping legal teams automate processes and improve efficiency.",Josef Q,"Josef Q is a no-code platform for creating automated Q&A, contract generation, and workflow tools, enabling legal teams to automate processes and improve efficiency.",Contracting & Document Automation,"AI Q&A,Workflow Automation",Automates legal processes to reduce repetitive tasks and improve efficiency.,Corporate legal; Private practice; Legal Operations Professionals,Enterprise-grade,North America (US & Canada); Europe (UK & EU); Asia-Pacific (APAC),Yes,Conversational / Copilot Layer; Natural Language Processing (NLP) / Text Analytics,,Subscription (SaaS),Demo Available,Growing Adoption,Easy,Cloud (SaaS),Corporate,English only,,,,,SOC 2 (Type I or II),,,,https://www.joseflegal.com,,83.0,82.83333333333333
Law In Order,"Law In Order is a leading provider of end-to-end document and digital solutions, specializing in legal, government, and corporate industries.",SmartBundle,"SmartBundle is a secure AI-powered platform for organising, managing, and presenting legal materials.","Litigation, Disputes & Investigations","eDiscovery,Document Review,eHearings",Streamlining legal document management and review processes.,Corporate legal; Government / Public Sector,Advanced,Australia,Yes,Natural Language Processing (NLP) / Text Analytics,Australia,Subscription (SaaS),Demo Available,Market Leader / Standard,Easy,Cloud (SaaS),Corporate,English only,"Sydney, Australia","Sydney, Brisbane, Melbourne, Perth, India",,,,,Positive feedback on efficiency and professionalism.,,https://www.lawinorder.com.au,Contact Us page available on the website.,88.0,40.66666666666666
Lawcadia,"Lawcadia is an award-winning end-to-end legal operations platform that helps corporate and government legal teams achieve greater efficiency, visibility, and control.",Lawcadia,"An intelligent end-to-end legal operations platform purpose built for in-house legal teams, enhancing collaboration, project management, and accountability.",Legal Operations & Analytics,"Matter Management,Spend Management,Reporting & Analytics","Streamlines intake, triage, workflows, and approvals while maintaining oversight of budgets, law firm engagements, documents, and emails.",Corporate legal; Government / Public Sector,,,Yes,AI Integration / Orchestration Layer,,,Demo Available,,,Cloud (SaaS),Corporate,English only,,,,,,,,,https://www.lawcadia.com,,22.5,1.851851851851852
Lawpath,Lawpath is an online legal service that makes it faster and easier for businesses to access legal solutions solely based on their own preferences.,Lawpath AI,"Lawpath AI provides clear and concise explanations of legal documents, analyses and provides valuable insights, and generates clauses for legal documents.",Contracting & Document Automation,"AI-Powered Document Insights,eSignature,Contract Management","Simplifies and automates the creation and management of legal documents, providing insights and guidance.",Corporate legal; Private practice; Legal Operations Professionals,Advanced,Australia,Yes,Natural Language Processing (NLP) / Text Analytics,,Subscription (SaaS),Demo Available,Growing Adoption,Very Easy,Cloud (SaaS),Corporate,English only,,,,,,,"10,000+ 5-Star Reviews",,https://lawpath.com.au,1800 529 728,72.0,54.629629629629626
LawVu,"LawVu provides a legal workspace that centralizes legal work, including matter management, contract management, spend management, and more, with AI-powered features.",LawVu Legal Workspace,"A comprehensive legal workspace that centralizes legal work, including matter management, contract management, spend management, and more, with AI-powered features.","Matter, Workflow & Intake Management","Contract management,Spend management,Document management",Centralizes legal work to improve efficiency and productivity with AI-powered features.,Corporate legal; Legal Operations Professionals,Enterprise-grade,,Yes,Natural Language Processing (NLP) / Text Analytics; AI Integration / Orchestration Layer,,Subscription (SaaS),Demo Available,Growing Adoption,Easy,Cloud (SaaS),Corporate,English only,"26-28 Wharf Street, Tauranga 3110, New Zealand","26-28 Wharf Street, Tauranga 3110, New Zealand",,,,,,,https://lawvu.com,"26-28 Wharf Street, Tauranga 3110, New Zealand",74.0,46.46296296296296
LEAP Legal Software,"LEAP Legal Software provides a cloud-based legal practice management solution that integrates document management, legal accounting, and legal publishing.",LEAP,"LEAP is a cloud-based legal practice management software that integrates document management, legal accounting, and legal publishing.","Matter, Workflow & Intake Management","Document management,legal accounting,and legal publishing","Provides an integrated solution for managing legal practice, including document management, accounting, and publishing.",Private practice,Enterprise-grade,Australia; New Zealand,Yes,Natural Language Processing (NLP) / Text Analytics,Australia,Subscription (SaaS),Demo Available,Mainstream / Proven,Easy,Cloud (SaaS),Corporate,English only,Australia,,,,,,,,https://www.leap.com.au,sales@leap.com.au,85.0,53.7037037037037
LexisNexis,"LexisNexis is a provider of legal, regulatory, and business information and analytics that helps advance the rule of law around the world.",Lexis+AI ,"Lexis+ AI helps lawyers research, draft, and summarise legal information faster, using AI trained on authoritative LexisNexis content rather than open web data.",AI Legal Assistants & Productivity Tools,"Legal research and workflow enhancements,Document Management",Enhances legal research efficiency and workflow through AI integration.,Corporate legal; Private practice,Enterprise-grade,Australia,Yes,Large Language Model (LLM) Platforms,Australia   ,Subscription (SaaS),"Free Trial,Demo Available",Growing Adoption,,Cloud (SaaS),Corporate,English only,,,,,,,,,https://www.lexisnexis.com/en-au,Call 1800 772 772,77.0,72.27777777777777
Neota,"Neota provides a platform for creating powerful solutions tailored to individual needs, focusing on legal, compliance, and innovation roles.",Neota Platform,"Neota Platform allows users to create and deploy decision-making solutions to automate workflows, documents, decisions, and processes.",Contracting & Document Automation,,"Automates workflows, documents, decisions, and processes to improve efficiency in legal and compliance roles.",Corporate legal; Compliance & Risk Teams,Advanced,,Yes,Natural Language Processing (NLP) / Text Analytics,,,,Growing Adoption,,Cloud (SaaS),Corporate,,,,,,,,,,https://www.neota.com,,66.0,40.37037037037037
NetDocuments,"NetDocuments is an intelligent document management system (DMS) platform that helps legal professionals automate routine tasks, streamline workflows, and collaborate on documents with AI built into the platform.",NetDocuments,"NetDocuments is a cloud-native document management system that helps legal professionals organize, secure, and collaborate on documents, with AI-powered automation and workflows.","Knowledge, Search & Precedent Management","Document Management,Legal AI & Workflow Automation","Automates routine tasks, streamlines workflows, and enhances document collaboration and security.",Corporate legal; Private practice; Legal Operations Professionals,Enterprise-grade,Asia-Pacific (APAC); North America (US & Canada); Europe (UK & EU); Latin America,Yes,Natural Language Processing (NLP) / Text Analytics; AI Integration / Orchestration Layer,Multi-Region / Distributed Cloud,Subscription (SaaS),Demo Available,Market Leader / Standard,Easy,Cloud (SaaS),Corporate,Multilingual (supports major global languages),"Lehi, Utah","United States, United Kingdom, Germany, Australia, Canada",Azure,ISO 27001,GDPR Compliance (EU),,,,https://www.netdocuments.com,"NetDocuments, 2500 Executive Parkway, Suite 300, Lehi, Utah 84048",100.0,38.55555555555556
NowInfinity,"NowInfinity is a platform for managing corporate compliance and legal documents, offering solutions like Corporate Messenger and Documentation Suite for entity creation and regulatory deeds.",NowInfinity,"A platform for managing corporate compliance and legal documents, including solutions for ASIC affairs and trust document creation.","Compliance, Risk & Governance",Corporate compliance and document management,Streamlines compliance and legal document creation for corporate entities.,Corporate legal; Legal Operations Professionals,,Australia,No,,Australia,Subscription (SaaS),Demo Available,Mainstream / Proven,Easy,Cloud (SaaS),Corporate,English only,Australia,,,,,,Positive feedback on efficiency and integration with Corporate Messenger.,,https://www.nowinfinity.com.au,,45.0,57.07407407407408
