Vendor Name,Vendor Overview,HQ,Office Locations,Regions Served,Year Founded,Product Name,Product Description,Languages supported,Legal Functionality – Main Category,Legal Functionality – Sub-Category,Main Problem Solved,Primary User Segment,AI Maturity Stage,Industry Focus,AI Powered,AI Platform,Deployment Model,Hosting Location / Data Residence,Hosting Provider,ISO Certifications,Security & Compliance Certifications,Pricing Model,Approx. Price Range (AUD),Demo / Proof of Concept Available,Adoption Level,Ease of Purchase,Customer Reviews,Customer Feedback Rating,Vendor Contact Details,Vendor Website
Xakia,"Xakia provides a comprehensive legal toolkit designed to simplify legal operations for in-house legal teams, offering features such as matter management, document management, intake and triage, contract management, spend management, and data analytics.",,,,,Xakia,"Xakia is a legal management software that offers matter management, document management, intake and triage, contract management, spend management, and data analytics to streamline legal operations for in-house legal teams.",English only,"Matter, Workflow & Intake Management","Document Management, Contract Management, Spend Management, Data & Analytics","Simplifies and centralizes legal operations, providing insights and efficiency for in-house legal teams.",Corporate legal,,Corporate,No,,Cloud (SaaS),,,,,Subscription (SaaS),,,Growing Adoption,Easy,Positive feedback from legal professionals highlighting time savings and improved efficiency.,,,https://www.xakiatech.com
Lawcadia,"Lawcadia is an award-winning end-to-end legal operations platform that helps corporate and government legal teams achieve greater efficiency, visibility, and control.",,,,,Lawcadia,"An intelligent end-to-end legal operations platform purpose built for in-house legal teams, enhancing collaboration, project management, and accountability.",English only,Legal Operations & Analytics,"Matter Management, Spend Management, Reporting & Analytics","Streamlines intake, triage, workflows, and approvals while maintaining oversight of budgets, law firm engagements, documents, and emails.",Corporate legal; Government / Public Sector,,Corporate,Yes,AI Integration / Orchestration Layer,Cloud (SaaS),,,,,,,Yes,,,,,,https://www.lawcadia.com
Plexus,"Plexus provides AI-powered legal technology solutions, including contract management, matter management, and marketing compliance tools, designed to streamline legal processes and improve efficiency.",,,,,Plexus Legal Suite,"Plexus Legal Suite offers contract management, matter management, and marketing compliance solutions to streamline legal processes and improve efficiency.",English only,Contracting & Document Automation,"Contract Management, Matter Management, Marketing Compliance","Streamlines legal processes, improves efficiency, and ensures compliance in contract and matter management.",Corporate legal,Enterprise-grade,Corporate,Yes,Natural Language Processing (NLP) / Text Analytics,Cloud (SaaS),,,,,Subscription (SaaS),,Yes,Growing Adoption,Easy,The system has just sold itself to the business. It’s taking an average of 18 minutes for an agreement to be generated.,,,https://www.plexus.co
Josef,"Josef provides legal AI tools for contract automation, workflow automation, and AI Q&A, helping legal teams automate processes and improve efficiency.",,,North America (US & Canada); Europe (UK & EU); Asia-Pacific (APAC),,Josef Q,"Josef Q is a no-code platform for creating automated Q&A, contract generation, and workflow tools, enabling legal teams to automate processes and improve efficiency.",English only,Contracting & Document Automation,"AI Q&A, Workflow Automation",Automates legal processes to reduce repetitive tasks and improve efficiency.,Corporate legal; Private practice; Legal Operations Professionals,Enterprise-grade,Corporate,Yes,Conversational / Copilot Layer; Natural Language Processing (NLP) / Text Analytics,Cloud (SaaS),,,,SOC 2 (Type I or II),Subscription (SaaS),,Yes,Growing Adoption,Easy,,,,https://www.joseflegal.com
Checkbox,"Checkbox is an AI-powered intake and workflow automation platform designed for legal teams to manage requests, gain visibility, and automate manual work.",,,,,Checkbox Platform,"Checkbox is an AI-powered platform for legal teams to automate intake, matter management, and reporting, providing a single source of truth and enabling legal teams to focus on strategic work.",English only,"Matter, Workflow & Intake Management",Intake and workflow automation for legal teams,"Automates legal intake and workflow processes, providing visibility and control over legal matters.",Corporate legal; Legal Operations Professionals,Enterprise-grade,Corporate,Yes,Natural Language Processing (NLP) / Text Analytics; Conversational / Copilot Layer,Cloud (SaaS),,,,,Subscription (SaaS),,Yes,Growing Adoption,Easy,,,,https://www.checkbox.ai
Gatekeeper,"Gatekeeper is a unified platform for contracting, managing third-party compliance & spend, powered by AI.",,,,,Gatekeeper,"Gatekeeper is a platform for contract lifecycle management, vendor lifecycle management, and third-party compliance, powered by AI.",,Contracting & Document Automation,"Contract Lifecycle Management, Vendor Lifecycle Management","Reduces vendor risk, accelerates contract processes, and optimizes spend management.",Corporate legal; Legal Operations Professionals; Contract Management Teams / Procurement,Enterprise-grade,Corporate,Yes,Natural Language Processing (NLP) / Text Analytics; AI Integration / Orchestration Layer,Cloud (SaaS),,,,,Subscription (SaaS),,Yes,Growing Adoption,Easy,Gatekeeper is highly rated for its contract management capabilities.,,,https://www.gatekeeperhq.com
LEAP Legal Software,"LEAP Legal Software provides a cloud-based legal practice management solution that integrates document management, legal accounting, and legal publishing.",Australia,,Australia; New Zealand,,LEAP,"LEAP is a cloud-based legal practice management software that integrates document management, legal accounting, and legal publishing.",English only,"Matter, Workflow & Intake Management","Document management, legal accounting, and legal publishing","Provides an integrated solution for managing legal practice, including document management, accounting, and publishing.",Private practice,Enterprise-grade,Corporate,Yes,Natural Language Processing (NLP) / Text Analytics,Cloud (SaaS),Australia,,,,Subscription (SaaS),,Yes,Mainstream / Proven,Easy,,,sales@leap.com.au,https://www.leap.com.au
LEAP Legal Software,"LEAP Legal Software provides a cloud-based legal practice management solution that integrates document management, legal accounting, and legal publishing.",Australia,,Australia; New Zealand,,LEAP,"LEAP is a cloud-based legal practice management software that integrates document management, legal accounting, and legal publishing.",English only,"Matter, Workflow & Intake Management","Document Management, Legal Accounting, Legal Publishing","Provides an integrated solution for managing legal practice, including document management, accounting, and publishing.",Private practice,Enterprise-grade,Corporate,Yes,Natural Language Processing (NLP) / Text Analytics,Cloud (SaaS),Australia,,,,Subscription (SaaS),,Yes,Mainstream / Proven,Easy,,,sales@leap.com.au,https://www.leap.com.au
Actionstep,"Actionstep is a modern, adaptable law firm management platform designed to automate and organize all the work that happens at midsize law firms.",,,,,Actionstep,"Actionstep is a cloud-based law firm management software that helps law firms automate and organize their operations, improve productivity, and manage client and firm data.",English only,"Matter, Workflow & Intake Management","Practice Management, Legal Accounting, Document Automation",Automates and organizes law firm operations to improve productivity and profitability.,Corporate legal; Private practice,Advanced,Corporate,Yes,Natural Language Processing (NLP) / Text Analytics,Cloud (SaaS),,,,,Subscription (SaaS),,Yes,Growing Adoption,Easy,"Positive reviews highlighting efficiency, user-friendliness, and cloud-based advantages.",,,https://www.actionstep.com
iManage,"iManage is a knowledge work platform that helps organizations manage documents and emails more efficiently, protect vital information assets, and use knowledge to drive better business outcomes.",,,,,iManage Platform,The iManage Platform is a cloud-native knowledge work platform that enhances productivity and mitigates risk with AI built-in natively.,,"Knowledge, Search & Precedent Management","Document & Email Management, Security & Governance, Risk & Compliance, Legal Transaction Management, Task & Workflow Management","Improves productivity, protects information assets, and uses knowledge to drive better business outcomes.",Corporate legal; Private practice; Compliance & Risk Teams,Enterprise-grade,Corporate,Yes,Natural Language Processing (NLP) / Text Analytics; AI Integration / Orchestration Layer,Cloud (SaaS),Multi-Region / Distributed Cloud,Other,,,,,Yes,Mainstream / Proven,Moderate,,,,https://www.imanage.com
NetDocuments,"NetDocuments is an intelligent document management system (DMS) platform that helps legal professionals automate routine tasks, streamline workflows, and collaborate on documents with AI built into the platform.","Lehi, Utah","United States, United Kingdom, Germany, Australia, Canada",Asia-Pacific (APAC); North America (US & Canada); Europe (UK & EU); Latin America,,NetDocuments,"NetDocuments is a cloud-native document management system that helps legal professionals organize, secure, and collaborate on documents, with AI-powered automation and workflows.",Multilingual (supports major global languages),"Knowledge, Search & Precedent Management","Document Management, Legal AI & Workflow Automation","Automates routine tasks, streamlines workflows, and enhances document collaboration and security.",Corporate legal; Private practice; Legal Operations Professionals,Enterprise-grade,Corporate,Yes,Natural Language Processing (NLP) / Text Analytics; AI Integration / Orchestration Layer,Cloud (SaaS),Multi-Region / Distributed Cloud,Azure,ISO 27001,GDPR Compliance (EU),Subscription (SaaS),,Yes,Market Leader / Standard,Easy,,,"NetDocuments, 2500 Executive Parkway, Suite 300, Lehi, Utah 84048",https://www.netdocuments.com
Thomson Reuters,,,,,,HighQ,"Effortless collaboration tools for legal professionals. Transform the way you work with a secure, cloud-based solution that streamlines processes, boosts productivity, and enhances service delivery.",,"Matter, Workflow & Intake Management",,"Streamlines processes, boosts productivity, and enhances service delivery for legal professionals.",Corporate legal; Private practice; Government / Public Sector,Enterprise-grade,Corporate,Yes,Natural Language Processing (NLP) / Text Analytics,Cloud (SaaS),,,,,Subscription (SaaS),,Yes,Growing Adoption,Moderate,,,800-950-1215,https://legal.thomsonreuters.com/en/products/highq
LexisNexis,"LexisNexis is a provider of legal, regulatory, and business information and analytics that aims to advance the rule of law around the world.",,,Australia,,Lexis+ AI,Lexis+ AI is a legal generative AI solution that integrates legal research with intelligent analysis and personalized workflow enhancements.,English only,AI Legal Assistants & Productivity Tools,"Legal generative AI solution with robust guardrails for confidentiality, security, and privacy.",Enhances legal research efficiency and provides strategic counsel through AI-powered tools.,Corporate legal; Private practice; Legal Operations Professionals,Enterprise-grade,Corporate,Yes,Large Language Model (LLM) Platforms,Cloud (SaaS),,,,,,,,Growing Adoption,,,,Call 1800 772 772,https://www.lexisnexis.com/en-au
LexisNexis,"LexisNexis is committed to advancing the rule of law around the world, providing legal AI solutions to enhance efficiency and ensure data security.",,,Australia,,Lexis+ AI,Lexis+ AI is a legal generative AI solution that integrates legal research with intelligent analysis and personalized workflow enhancements.,English only,AI Legal Assistants & Productivity Tools,"Legal generative AI solution with robust guardrails for confidentiality, security, and privacy.",Enhances legal research efficiency and ensures data security and accuracy of outputs.,Corporate legal; Private practice,Enterprise-grade,Corporate,Yes,Large Language Model (LLM) Platforms,Cloud (SaaS),,,,GDPR Compliance (EU),,,,Growing Adoption,,,,Call 1800 772 772,https://www.lexisnexis.com/en-au
LexisNexis,"LexisNexis is a provider of legal, regulatory, and business information and analytics that helps advance the rule of law around the world.",,,Australia,,Lexis+ AI,Lexis+ AI is a legal generative AI solution that integrates legal research with intelligent analysis and personalized workflow enhancements.,English only,AI Legal Assistants & Productivity Tools,,Enhances legal research efficiency and workflow through AI integration.,Corporate legal; Private practice,Enterprise-grade,Corporate,Yes,Large Language Model (LLM) Platforms,Cloud (SaaS),,,,,,,,Growing Adoption,,,,Call 1800 772 772,https://www.lexisnexis.com/en-au
LexisNexis,"LexisNexis is a provider of legal, regulatory, and business information and analytics that helps advance the rule of law around the world.",,,Australia,,Lexis+ AI,Lexis+ AI is a legal generative AI solution that integrates legal research with intelligent analysis and personalized workflow enhancements.,English only,AI Legal Assistants & Productivity Tools,Legal research and workflow integration,Enhances legal research efficiency and workflow integration using AI.,Corporate legal; Private practice,Enterprise-grade,Corporate,Yes,Large Language Model (LLM) Platforms,Cloud (SaaS),,,,,,,,Growing Adoption,,,,Call 1800 772 772,https://www.lexisnexis.com/en-au
LexisNexis,"LexisNexis is a provider of legal, regulatory, and business information and analytics that aims to advance the rule of law around the world.",,,Australia,,Lexis+ AI,Lexis+ AI is a legal generative AI solution that integrates legal research with intelligent analysis and personalized workflow enhancements.,English only,AI Legal Assistants & Productivity Tools,"Legal generative AI solution with robust guardrails for confidentiality, security, and privacy.",Enhances legal research efficiency and provides strategic counsel through AI-powered tools.,Corporate legal; Private practice; Legal Operations Professionals,Enterprise-grade,Corporate,Yes,Large Language Model (LLM) Platforms,Cloud (SaaS),,,,,,,,Growing Adoption,,,,Call 1800 772 772,https://www.lexisnexis.com/en-au
LexisNexis,"LexisNexis is a provider of legal, regulatory, and business information and analytics that aims to advance the rule of law around the world.",,,Australia,,Lexis+ AI,Lexis+ AI is a legal generative AI solution that integrates legal research with intelligent analysis and personalized workflow enhancements.,English only,AI Legal Assistants & Productivity Tools,,Enhances legal research efficiency and provides personalized workflow enhancements.,Corporate legal; Private practice,Enterprise-grade,Corporate,Yes,Large Language Model (LLM) Platforms,Cloud (SaaS),,,,,,,,Growing Adoption,,,,Call 1800 772 772,https://www.lexisnexis.com/en-au
LexisNexis,LexisNexis is committed to advancing the rule of law around the world by providing legal AI solutions that enhance efficiency and provide strategic counsel.,,,Australia,,Lexis+ AI,Lexis+ AI is a legal generative AI solution that integrates legal research with intelligent analysis and personalized workflow enhancements.,English only,AI Legal Assistants & Productivity Tools,Legal research and workflow enhancements,Enhances legal research efficiency and provides strategic counsel through AI.,Corporate legal; Private practice,Enterprise-grade,Corporate,Yes,Large Language Model (LLM) Platforms,Cloud (SaaS),,,,GDPR Compliance (EU),,,,Growing Adoption,,,,Call 1800 772 772,https://www.lexisnexis.com/en-au
LexisNexis,"LexisNexis is committed to advancing the rule of law around the world, providing legal AI solutions to enhance efficiency and ensure data security.",,,Australia,,Lexis+ AI,Lexis+ AI is a legal generative AI solution that integrates legal research with intelligent analysis and personalized workflow enhancements.,English only,AI Legal Assistants & Productivity Tools,"Legal generative AI solution with robust guardrails for confidentiality, security, and privacy.","Enhances legal efficiency, ensures data security, and provides a solid return on investment.",Corporate legal; Private practice,Enterprise-grade,Corporate,Yes,Large Language Model (LLM) Platforms,Cloud (SaaS),,,,,,,,Growing Adoption,,,,Call 1800 772 772,https://www.lexisnexis.com/en-au
LexisNexis,"LexisNexis is a provider of legal, regulatory, and business information and analytics that aims to advance the rule of law around the world.",,,Australia,,Lexis+ AI,Lexis+ AI is a legal generative AI solution that integrates legal research with intelligent analysis and personalized workflow enhancements.,English only,AI Legal Assistants & Productivity Tools,"Legal generative AI solution with robust guardrails for confidentiality, security, and privacy.",Enhances legal research efficiency and provides strategic counsel through AI-powered tools.,Corporate legal; Private practice,Enterprise-grade,Corporate,Yes,Large Language Model (LLM) Platforms,Cloud (SaaS),,,,,,,,Growing Adoption,,,,Call 1800 772 772 to contact a LexisNexis expert.,https://www.lexisnexis.com/en-au
Nuix,"Nuix is a leading provider of investigative analytics and intelligence software, empowering customers to transform vast amounts of unstructured data into actionable insights with speed, scalability, and forensic accuracy.",,"11 offices globally across North America, EMEA, and APAC",North America (US & Canada); Europe (UK & EU); Asia-Pacific (APAC),,Nuix Neo,"Nuix Neo is a highly customizable, solution-based platform designed to meet unique data challenges, offering core data processing, data privacy solutions, legal eDiscovery, and early case assessment capabilities.",,"Litigation, Disputes & Investigations","eDiscovery, Early Case Assessment, Investigations","Transforms vast amounts of unstructured data into actionable insights with speed, scalability, and forensic accuracy.",Corporate legal; Government / Public Sector; Legal Operations Professionals,Enterprise-grade,Other / Not Specified,Yes,Natural Language Processing (NLP) / Text Analytics; Domain-Specific or Proprietary AI Engines,Hybrid,,,,"FedRAMP, Authorization (US)",,,,Mainstream / Proven,,,,,https://www.nuix.com
Reveal,"Reveal is a leader in AI-powered eDiscovery and investigations, offering comprehensive solutions for legal and compliance challenges.",,,,2008,Reveal,"Comprehensive AI-powered eDiscovery software for legal departments of any size, offering advanced analytics and streamlined legal holds.",,"Litigation, Disputes & Investigations","eDiscovery, Legal Holds, Subpoena Response, Early Case Assessment","Simplifies complex data challenges, streamlines legal holds, and reduces costs in eDiscovery and investigations.",Corporate legal; Private practice; Alternative Legal Service Providers (ALSPs); Government / Public Sector,Enterprise-grade,Corporate,Yes,Large Language Model (LLM) Platforms; Predictive / Machine Learning (ML) Platforms; Natural Language Processing (NLP) / Text Analytics,Cloud (SaaS),,,,,Subscription (SaaS),,,Market Leader / Standard,,,,"Get in touch with us for general inquiries, sales, etc.",https://www.revealdata.com
Everlaw,"Everlaw provides advanced ediscovery software designed to simplify complex legal work for law firms, corporations, and government agencies.",United States,"United States, United Kingdom, Canada, European Union, Australia",North America (US & Canada); Europe (UK & EU); Australia,,Everlaw Platform,"Everlaw is a cloud-native ediscovery platform that offers advanced analytics, machine learning, and collaboration tools for legal professionals.",English only,"Litigation, Disputes & Investigations","Ediscovery, Early Case Assessment, Legal Holds, Trial Preparation, Internal Investigations",Simplifies complex legal work through advanced ediscovery tools and automation.,Corporate legal; Private practice; Government / Public Sector,Enterprise-grade,Other / Not Specified,Yes,Predictive / Machine Learning (ML) Platforms; Natural Language Processing (NLP) / Text Analytics,Cloud (SaaS),Multi-Region / Distributed Cloud,,,SOC 2 (Type I or II),Subscription (SaaS),,Yes,Mainstream / Proven,Easy,,,1 (844) EVERLAW (383-7529),https://www.everlaw.com
Law In Order,"Law In Order is a leading provider of end-to-end document and digital solutions, specializing in legal, government, and corporate industries.","Sydney, Australia","Sydney, Brisbane, Melbourne, Perth, India",Australia,,SmartBundle,"SmartBundle is a secure AI-powered platform for organising, managing, and presenting legal materials.",English only,"Litigation, Disputes & Investigations","eDiscovery, Document Review, eHearings",Streamlining legal document management and review processes.,Corporate legal; Government / Public Sector,Advanced,Corporate,Yes,Natural Language Processing (NLP) / Text Analytics,Cloud (SaaS),Australia,,,,Subscription (SaaS),,Yes,Market Leader / Standard,Easy,Positive feedback on efficiency and professionalism.,,Contact Us page available on the website.,https://www.lawinorder.com.au
Sky Discovery,"Sky Discovery provides eDiscovery solutions with a focus on enhancing Relativity One and Relativity Server, offering custom solutions and AI capabilities to support legal professionals.",Australia,,Australia; United Kingdom,,Relativity Solutions,Custom solutions designed to enhance Relativity One and Relativity Server with AI capabilities for eDiscovery processes.,Multilingual (supports major global languages),"Litigation, Disputes & Investigations",eDiscovery and data management solutions,"Enhancing eDiscovery processes with AI to manage data collection, analysis, and review.",Litigation / Disputes Teams,Advanced,Corporate,Yes,Natural Language Processing (NLP) / Text Analytics; Computer Vision & Document Recognition,Cloud (SaaS),,,ISO 27001,,,,,,,,,,https://www.skydiscovery.com.au
InfoTrack,"InfoTrack provides purpose-built, award-winning technology for legal, conveyancing, and other professional services, focusing on innovation and efficiency.",Australia,,Australia,,,"InfoTrack offers a range of solutions including client onboarding, identity verification, contract review, settlement services, and more, with a focus on AI-assisted precision and integration with existing workflows.",English only,Contracting & Document Automation,,Improves operational efficiency and accuracy in legal and conveyancing processes through automation and integration.,Corporate legal; Private practice,Enterprise-grade,Corporate,Yes,Natural Language Processing (NLP) / Text Analytics,Cloud (SaaS),Australia,,ISO 27001; ISO 9001,,,,,,,,,Get in touch with a member of our team,https://www.infotrack.com.au
PEXA,"PEXA connects people, businesses and governments across the property ecosystem, delivering secure digital infrastructure, integrated solutions and actionable insights.",,,Australia,,PEXA Exchange,An online conveyancing platform providing a streamlined and collaborative property exchange process.,English only,"Cross-Border, Transactions & Deal Management",Property settlement platform,Streamlines and secures the property settlement process.,Corporate legal; Private practice,,Corporate,No,,Cloud (SaaS),Australia,,,,Usage-Based / Consumption,,,Mainstream / Proven,Moderate,,,,https://www.pexa.com.au
Annature,"Australia's leading eSignature & Client verification provider, offering secure and efficient eSigning and client verification solutions.",Australia,,Australia,,Annature eSignature,A digital signature product providing a quick and secure way to send documents and agreements for electronic signature.,English only,Contracting & Document Automation,eSignature and client verification,"Streamlines digital signing and identity verification processes, making them more efficient and secure.",Corporate legal; Private practice,,Corporate,No,,Cloud (SaaS),Australia,,ISO 27001,,Usage-Based / Consumption,<$10K,Yes,Growing Adoption,Easy,,,,https://www.annature.com.au
Secured Signing,"Secured Signing is a trusted, all-in-one platform for legally-binding Digital Signatures and Remote Online Notarization (RON).",,,,2010,Secured Signing,"A platform for digital signatures and remote online notarization, ensuring secure and legally-binding document workflows.",,Contracting & Document Automation,Digital Signatures and Remote Online Notarization,"Streamlines document signing processes and ensures compliance with secure, tamper-proof digital signatures.",Corporate legal; Government / Public Sector,,Other / Not Specified,No,,Cloud (SaaS),,,ISO 27001,SOC 2 (Type I or II),Usage-Based / Consumption,,,Growing Adoption,Easy,Rated 4.7 out of 5 by our customers,4.7,,https://www.securedsigning.com
Diligent,,,,,,,,,,,,,,,,,,,,,,,,,,,,,,https://www.diligent.com
